Question,Correct Answer,Incorrect Answer 1,Incorrect Answer 2,Incorrect Answer 3,Difficulty,Status
What is the capital of Nigeria?,Abuja,Lagos,Port Harcourt,Kano,medium,active
Which river is the longest in Africa?,Nile River,Congo River,Niger River,Zambezi River,medium,active
What is the largest desert in Africa?,Sahara Desert,Namib Desert,Kalahari Desert,Arabian Desert,easy,active
Who was the first president of Ghana?,Kwame Nkrumah,Jomo Kenyatta,Nelson Mandela,Julius Nyerere,hard,active
What is the highest mountain in Africa?,Mount Kilimanjaro,Mount Kenya,Mount Stanley,Atlas Mountains,medium,active
